{
  "$schema": "https://raw.githubusercontent.com/xsyetopz/go-mamacord/refs/heads/main/schemas/signature.schema.json",
  "algorithm": "ed25519-sha256",
  "hash_b64": "3A6NZ9zGeS4G+2a9JSDtNiEB2u4kL00N0Wpw/R0DqkM=",
  "key_id": "official-release-2026-08-20",
  "signature_b64": "bpN7i3xl7y/cCTeug3L6vW8sTYqzI7MXp+VFzPpb6u3CMOBsfD8FYurmu8+k74xPeObo9FaZShP27PnupltZCg=="
}
