{
  "$schema": "https://raw.githubusercontent.com/xsyetopz/go-mamacord/refs/heads/main/schemas/signature.schema.json",
  "algorithm": "ed25519-sha256",
  "hash_b64": "OvyCMQW2f2+J/bSOoQmJR4QTS1QN0OaNqXJM3kaVtus=",
  "key_id": "official-release-2026-08-20",
  "signature_b64": "rjU71qV2jeuuQwEP5PlhmhRQq2eUfOTQzWq/KzA0uxWJ1BTNwOk4IsrjccmZQul7iVjU7BljRjOaOq5vRsOmCg=="
}
