{
  "$schema": "https://raw.githubusercontent.com/xsyetopz/go-mamacord/refs/heads/main/schemas/signature.schema.json",
  "algorithm": "ed25519-sha256",
  "hash_b64": "LofDFUYcjGEXd5UzzSpYQUMCwHOH3bThkMc7W+QN+ms=",
  "key_id": "official-release-2026-08-20",
  "signature_b64": "dnMKEpc6hTMttP9Sb5uruT22ykr9VRSOAoeoWsWkWseLAzu3xeS4aB8Mm0GWXIoNLmsL0+1nQMT16i7cwwQyDA=="
}
