{
  "$schema": "https://raw.githubusercontent.com/xsyetopz/go-mamacord/refs/heads/main/schemas/signature.schema.json",
  "algorithm": "ed25519-sha256",
  "hash_b64": "kk8fei1Gzm/X9RE8nSVhVCGqczSvzByYCg1iAVWEGQI=",
  "key_id": "official-release-2026-08-20",
  "signature_b64": "XEziZubupGgfPAtbygVdLC1xqSWd8XR4jnyxex5HPWM2lUnqEQuGKUDISJA5N7nv2TjPZ/u6TN4Zuv5YuQJsAA=="
}
