{
  "$schema": "https://raw.githubusercontent.com/xsyetopz/go-mamacord/refs/heads/main/schemas/signature.schema.json",
  "algorithm": "ed25519-sha256",
  "hash_b64": "zAbrW4xzOluunV7Zla+/hvZXoo68WPizT+9wbEET2CQ=",
  "key_id": "official-release-2026-08-20",
  "signature_b64": "BQ4F3P8tM7TfIJB3G5/9oizenrpTP78sG5tVpTumrsoNzrE1i4BPtpG4aOomhDJgpC+qyUK7onZIQabPk7q7Aw=="
}
